{
  "schema_version":"v1",
  "request_id":"demo-001",
  "mode":"raw_factors",
  "strategy_id":"momentum_v1",
  "strategy_version":"1.0.0",
  "as_of":"2026-10-08",
  "snapshot_hash":"aaaaaaaaaaaaaaaaaaaaaaaaaaaaaaaaaaaaaaaaaaaaaaaaaaaaaaaaaaaaaaaa",
  "config_hash":"bbbbbbbbbbbbbbbbbbbbbbbbbbbbbbbbbbbbbbbbbbbbbbbbbbbbbbbbbbbbbbbb",
  "data_ref":{"kind":"local_file","path":"/sandbox/snapshots/demo.json","sha256":"cccccccccccccccccccccccccccccccccccccccccccccccccccccccccccccccc","format":"json"},
  "params":{}
}
